title,company,salary,link,experience,grade,remote,metro,query,skills_found,published_date
Продуктовый аналитик в направление Публикации,ООО HeadHunter::Продуктовые аналитики,Не указана,https://hh.ru/vacancy/132748741,Опыт 3-6 лет,не указан,Да,Белорусская,data analyst,"python, sql, hadoop, tableau, airflow",
Системный аналитик (Security),YADRO,Не указана,https://hh.ru/vacancy/130925274,Опыт 3-6 лет,не указан,Да,Не указано,data analyst,"jira, confluence",
Руководитель группы продуктовой аналитики,"VK, Одноклассники",Не указана,https://hh.ru/vacancy/132696700,Опыт более 6 лет,не указан,Нет,Аэропорт,data analyst,"python, sql, power bi, tableau, superset, looker, pandas, numpy, matplotlib, ml",
Аналитик (Private banking),ЛОКО-БАНК,Не указана,https://hh.ru/vacancy/131774350,Опыт 1-3 года,не указан,Нет,Аэропорт,data analyst,sql,
Лид продуктовой аналитики в ЦЭБ,Т-Банк. Бизнес и процессы. Compliance,Не указана,https://hh.ru/vacancy/132760452,Опыт 3-6 лет,lead,Нет,Белорусская,data analyst,"python, sql, clickhouse, greenplum, hadoop, tableau, superset, jira, a/b, машинное обучение",
"Старший аналитик данных, Ozon Банк",Ozon Банк,Не указана,https://hh.ru/vacancy/129378339,Опыт 3-6 лет,senior,Нет,Москва-Сити,data analyst,"python, sql, power bi, tableau, superset, airflow, pandas, numpy, etl",
Tech Unit Lead (Marketing Experience),Циан,Не указана,https://hh.ru/vacancy/131545055,Опыт 3-6 лет,lead,Да,Не указано,data analyst,"python, ml",
Руководитель направления (Аналитика закупочной деятельности),РУСАЛ,Не указана,https://hh.ru/vacancy/128393213,Опыт более 6 лет,не указан,Нет,Багратионовская,data analyst,"oracle, power bi, superset, excel",
Старший продуктовый аналитик,Иви,Не указана,https://hh.ru/vacancy/132577794,Опыт 3-6 лет,senior,Нет,Дмитровская,data analyst,"python, sql, clickhouse, spark, a/b",
Аналитик новых ниш на маркетплейсах в Москве,KORSHUNOVA.PRO,Не указана,https://hh.ru/vacancy/132893322,Опыт 1-3 года,не указан,Да,Перово,data analyst,"power bi, tableau, excel, google sheets",
Бизнес аналитик 1С (Транспортный ЭДО),ООО Сбер2B,Не указана,https://hh.ru/vacancy/132623170,Опыт 3-6 лет,не указан,Нет,Воронцовская,data analyst,"1с, api",
Менеджер проектов оптимизации эффективности документирования Yandex Crowd,Команда Поисковых сервисов и ИИ,Не указана,https://hh.ru/vacancy/132640169,Опыт 3-6 лет,не указан,Нет,Октябрьская,data analyst,Не найдено,
Руководитель направления кроссблочной аналитики и отчетности,Альфа-Банк,Не указана,https://hh.ru/vacancy/132594943,Опыт 3-6 лет,не указан,Да,Не указано,data analyst,"sql, etl",
Аналитик данных (BI&DWH) кроссканального антифрода,ООО РСХБ-Интех,Не указана,https://hh.ru/vacancy/131821849,Опыт 3-6 лет,не указан,Да,Генерала Тюленева,data analyst,"clickhouse, airflow, spark, kafka",
Аналитик по фрахту и морской логистике,S7 Group,Не указана,https://hh.ru/vacancy/132212680,Опыт 1-3 года,не указан,Нет,Охотный ряд,data analyst,"python, tableau, excel",
Руководитель направления стратегической аналитики розничного бизнеса,АО Банк ДОМ.РФ Другие подразделения,Не указана,https://hh.ru/vacancy/130835022,Опыт 3-6 лет,не указан,Нет,Динамо,data analyst,"python, sql, power bi, tableau, qlik, a/b",
Менеджер по маркетплейсам Wildberries и Ozon,ИП Самир Александр Абдулович,Не указана,https://hh.ru/vacancy/133326268,Опыт 1-3 года,не указан,Да,Библиотека им.Ленина,data analyst,Не найдено,
CDO | Директор управления по данным и BI-аналитики,ASTERUS (ООО ВХД Менеджмент),Не указана,https://hh.ru/vacancy/132551529,Опыт более 6 лет,не указан,Нет,Новокузнецкая,data analyst,"postgresql, clickhouse, a/b, etl",
Product Lead,Центральный университет,Не указана,https://hh.ru/vacancy/131966479,Опыт 3-6 лет,lead,Нет,Маяковская,data analyst,Не найдено,
MLOps Engineer / Инженер ML-инфраструктуры,NGENIX,Не указана,https://hh.ru/vacancy/132567152,Опыт 3-6 лет,не указан,Да,Гражданская,data analyst,"python, sql, clickhouse, airflow, kafka, dbt, etl, ml",
Ведущий инженер данных,Сloud.ru: Кибербезопасность,Не указана,https://hh.ru/vacancy/133304770,Опыт 3-6 лет,не указан,Да,Не указано,data analyst,"sql, clickhouse, etl",
Администратор проектов,Московский метрополитен,Не указана,https://hh.ru/vacancy/133412711,Опыт 1-3 года,не указан,Нет,Белорусская,data analyst,"sql, hadoop, spark, jira, confluence",
Тимлид операционной аналитики (Fulfillment & HR Ops) / Operations Analytics Team Lead,UZUM TECHNOLOGIES. IT,Не указана,https://hh.ru/vacancy/132681455,Опыт более 6 лет,lead,Да,Не указано,data analyst,a/b,
СPO / Head of Product (iGaming),ИП Штергер Евгений Владимирович,Не указана,https://hh.ru/vacancy/132963783,Опыт 3-6 лет,не указан,Да,Не указано,data analyst,a/b,
AI Operations manager в кадровое агентство,Assisteca,Не указана,https://hh.ru/vacancy/132934563,Опыт 3-6 лет,не указан,Да,Библиотека им.Ленина,data analyst,Не найдено,
UX/UI-дизайнер (Middle),ДЖЕЙКЕТ РАБОТА,Не указана,https://hh.ru/vacancy/133095082,Без опыта,middle,Нет,Багратионовская,data analyst,ml,
Инженер по внедрению/SQL разработчик,ics-it,Не указана,https://hh.ru/vacancy/132806658,Опыт 1-3 года,не указан,Да,ВДНХ,data analyst,"sql, jira, etl",
ML-инженер,Ozon Офис и Коммерция,Не указана,https://hh.ru/vacancy/133392771,Опыт 1-3 года,не указан,Да,Деловой центр,data analyst,"postgresql, clickhouse, trino, airflow, kafka, a/b, ml",
Middle+ / Senior Python Developer (Backend + Analytics),AbeloHost B.V.,Не указана,https://hh.ru/vacancy/132764733,Опыт 3-6 лет,senior,Да,Не указано,data analyst,"python, sql, postgresql, clickhouse, api",
Дата-инженер,"""МТС"", Аналитика",Не указана,https://hh.ru/vacancy/131952894,Опыт 1-3 года,не указан,Нет,Пражская,data analyst,"python, sql, superset, airflow, git, etl, api",
Head of Digital Marketing,АНОВО МОСКОВСКИЙ МЕЖДУНАРОДНЫЙ УНИВЕРСИТЕТ,Не указана,https://hh.ru/vacancy/132634591,Опыт более 6 лет,не указан,Нет,Белорусская,data analyst,Не найдено,
Senior Conversion Specialist / A/B Testing Specialist,Realmo,Не указана,https://hh.ru/vacancy/133405514,Опыт 3-6 лет,senior,Да,Не указано,data analyst,a/b,
"Менеджер по работе с аптечными сетями (Key Account Manager, фарма)",VIATRIS,Не указана,https://hh.ru/vacancy/133241099,Опыт 1-3 года,не указан,Нет,Аэропорт,data analyst,excel,
Менеджер по работе с ключевыми клиентами в канале E-соm,Fleur Alpine,Не указана,https://hh.ru/vacancy/132872763,Опыт 1-3 года,не указан,Нет,Марксистская,data analyst,Не найдено,
Инженер по сопровождению/системный администратор (Olap кубы),USETECH,Не указана,https://hh.ru/vacancy/133391006,Опыт 3-6 лет,не указан,Нет,Технопарк,data analyst,"sql, postgresql, superset, airflow, jira, confluence, etl, ml",
Инженер данных,Российское общество Знание,Не указана,https://hh.ru/vacancy/133411242,Опыт 1-3 года,не указан,Нет,Добрынинская,data analyst,"python, sql, postgresql, clickhouse, datalens, airflow, dbt, pandas, etl",
Head of Business Systems Analysis and Engineering,ООО Брайт Эйдженси,Не указана,https://hh.ru/vacancy/133370044,Опыт более 6 лет,не указан,Нет,Не указано,data analyst,"jira, confluence, api",
Специалист службы технической поддержки,ООО Диджитал медикэл оперейшнс,Не указана,https://hh.ru/vacancy/133347822,Опыт 1-3 года,не указан,Да,Деловой центр,data analyst,sql,
Директор по техническому развитию,ООО Центр Новых Финансовых Сервисов,Не указана,https://hh.ru/vacancy/133361339,Опыт 3-6 лет,не указан,Нет,Не указано,data analyst,Не найдено,
Performance-маркетолог (Специалист по платной рекламе),PETSEE,Не указана,https://hh.ru/vacancy/132564596,Опыт 3-6 лет,не указан,Да,Не указано,data analyst,Не найдено,
IT менеджер,Aston,Не указана,https://hh.ru/vacancy/133042336,Без опыта,не указан,Да,Не указано,data analyst,Не найдено,
Бизнес-ассистент,ООО Гидфинанс,Не указана,https://hh.ru/vacancy/132897513,Опыт 1-3 года,не указан,Нет,Ломоносовский проспект,data analyst,Не найдено,
Дизайнер цифровых продуктов (инвестиции / трейдинг / финтех),ООО Аналитика ИТ Лаб,Не указана,https://hh.ru/vacancy/132993299,Опыт 3-6 лет,не указан,Да,Не указано,data analyst,"jira, confluence",
Разработчик DWH и BI ЕХД Oracle,МТС Банк. IT,Не указана,https://hh.ru/vacancy/133365839,Опыт 3-6 лет,не указан,Да,Автозаводская,data analyst,"sql, oracle, jira, confluence",
Менеджер по маркетингу / Marketing Manager Russia & CIS,DiagnoCat,Не указана,https://hh.ru/vacancy/132763022,Опыт 3-6 лет,не указан,Да,Не указано,data analyst,битрикс,
Руководитель ВЭД/менеджер ВЭД (импорт из Китая)/Таможенный декларант,ООО Интернет РЕВОЛЮЦИЯ,Не указана,https://hh.ru/vacancy/133395536,Опыт 3-6 лет,не указан,Да,Не указано,data analyst,Не найдено,
Главный эксперт экспертизы и анализа данных УВА,АЛРОСА.Офис,Не указана,https://hh.ru/vacancy/131501135,Опыт 3-6 лет,не указан,Нет,Не указано,data analyst,"python, sql, power bi, 1с",
Руководитель группы карточных продуктов,АО Банк ДОМ.РФ Другие подразделения,Не указана,https://hh.ru/vacancy/133320894,Опыт более 6 лет,не указан,Нет,Беговая,data analyst,Не найдено,
Head of Support Automation & AI,Wanted,Не указана,https://hh.ru/vacancy/133388684,Опыт более 6 лет,не указан,Да,Волковская,data analyst,Не найдено,
Senior User Acquisition Manager,Лига Ставок,Не указана,https://hh.ru/vacancy/133208397,Опыт 3-6 лет,senior,Нет,Белорусская,data analyst,excel,
Специалист клиентского сервиса / Оператор 1С (отдел продаж),Integraaal,Не указана,https://hh.ru/vacancy/133344327,Опыт 1-3 года,не указан,Нет,Бутырская,data analyst,"excel, 1с",
Маркетолог по управлению взаимоотношениями с клиентами (CRM-маркетолог),ПАО Аэрофлот,Не указана,https://hh.ru/vacancy/129342286,Опыт 1-3 года,не указан,Нет,Александровский сад,data analyst,Не найдено,
Администратор баз данных (Oracle/Greenplum),Мегаполис,Не указана,https://hh.ru/vacancy/132168094,Опыт 3-6 лет,не указан,Нет,Не указано,data analyst,Не найдено,
Продуктовый дизайнер/Проектировщик интерфейсов,ЦРТ | Группа компаний,Не указана,https://hh.ru/vacancy/132388020,Опыт 3-6 лет,не указан,Нет,Не указано,data analyst,Не найдено,
Teamlead product analytics (monetization),Циан,Не указана,https://hh.ru/vacancy/130926985,Опыт более 6 лет,lead,Да,Преображенская площадь,data analyst,"python, sql, pandas, numpy, a/b",
Senior Product Manager (Fintech / Lending / Cards),Devhunt,Не указана,https://hh.ru/vacancy/133291125,Опыт более 6 лет,senior,Да,Не указано,data analyst,Не найдено,
Менеджер продукта в CRM платформу,Яндекс Такси,Не указана,https://hh.ru/vacancy/133301924,Опыт 3-6 лет,не указан,Нет,Деловой центр,data analyst,ml,
Менеджер по CPA маркетингу (СберПрайм),Сбер для экспертов,Не указана,https://hh.ru/vacancy/133310429,Опыт 1-3 года,не указан,Нет,Не указано,data analyst,Не найдено,
"Product manager/CJE в Дивизион ""Массовый высокодоходный сегмент""",Сбер. Экспертам и руководителям,Не указана,https://hh.ru/vacancy/133316502,Опыт более 6 лет,не указан,Нет,Не указано,data analyst,a/b,
Tech Lead java,Сбер. IT,Не указана,https://hh.ru/vacancy/133264389,Опыт более 6 лет,lead,Нет,Не указано,data analyst,"postgresql, kafka",
Менеджер по внедрению и развитию ИИ-решений,Сбер. Кибербезопасность,Не указана,https://hh.ru/vacancy/133367769,Опыт 1-3 года,не указан,Нет,Не указано,data analyst,"python, power bi, tableau, datalens, api, ml",
Директор по персоналу,Кадровый центр «ПРЕЗИДЕНТ»,Не указана,https://hh.ru/vacancy/133347410,Опыт более 6 лет,не указан,Нет,Не указано,data analyst,"power bi, tableau, 1с",
Product-owner (денежные переводы),ООО НЕО Ломбард,Не указана,https://hh.ru/vacancy/132710074,Опыт 3-6 лет,не указан,Нет,Не указано,data analyst,Не найдено,
SMM-менеджер в торговую компанию,ВОДОВОЗ.RU,Не указана,https://hh.ru/vacancy/133325778,Опыт 1-3 года,не указан,Нет,Текстильщики,data analyst,"tableau, looker",
Digital-маркетолог / Junior digital-маркетолог,Толстов груп,Не указана,https://hh.ru/vacancy/128372338,Опыт 1-3 года,junior,Да,Не указано,data analyst,Не найдено,
Tech Lead,Сбер. IT,Не указана,https://hh.ru/vacancy/132377261,Опыт 3-6 лет,lead,Нет,Не указано,data analyst,"sql, api",
Старший специалист по медиапланированию (МТС AdTech),"""МТС"", Маркетинг и PR",Не указана,https://hh.ru/vacancy/133135714,Опыт 3-6 лет,senior,Нет,Технопарк,data analyst,Не найдено,
Архитектор (HR tech),АРЕАЛ,Не указана,https://hh.ru/vacancy/132371467,Опыт 3-6 лет,не указан,Нет,Деловой центр,data analyst,"1с, api",
Главный специалист (ALM-система),АО ГК Орбита,Не указана,https://hh.ru/vacancy/133272268,Опыт 3-6 лет,не указан,Нет,Автозаводская,data analyst,"sql, postgresql, superset, airflow, jira, confluence, etl",
Senior Java Developer (Backend),Бэнкс Софт Системс,Не указана,https://hh.ru/vacancy/133249537,Опыт более 6 лет,senior,Да,Не указано,data analyst,"sql, postgresql, kafka, api",
Head of KOL / Influencer/ Менеджер по работе с блогерами и соцсетями,Realme,Не указана,https://hh.ru/vacancy/133324586,Опыт 3-6 лет,не указан,Нет,Автозаводская,data analyst,Не найдено,
Менеджер по работе с системой Честный знак,NEW YORKER,Не указана,https://hh.ru/vacancy/133301910,Опыт 1-3 года,не указан,Нет,Добрынинская,data analyst,"excel, 1с",
Технический продукт менеджер (Статистика и атрибуция),RWB (Wildberries & Russ),Не указана,https://hh.ru/vacancy/133007919,Опыт 3-6 лет,не указан,Нет,Новокузнецкая,data analyst,"sql, api",
Frontend-разработчик,X5 Tech,Не указана,https://hh.ru/vacancy/133300872,Опыт 3-6 лет,не указан,Нет,Савёловская,data analyst,Не найдено,
Копирайтер,ООО ДЮК Технологии,Не указана,https://hh.ru/vacancy/133238568,Опыт 1-3 года,не указан,Да,Не указано,data analyst,Не найдено,
Руководитель группы управления рекламными продуктами,АО Диджитал Альянс,Не указана,https://hh.ru/vacancy/133238843,Опыт 3-6 лет,не указан,Нет,Не указано,data analyst,Не найдено,
Ведущий менеджер по управлению доходами,ООО PepsiCo,Не указана,https://hh.ru/vacancy/127354928,Опыт 3-6 лет,не указан,Нет,Аэропорт,data analyst,"python, ml",
Product owner (Персональные налоги),Сбер для экспертов,Не указана,https://hh.ru/vacancy/133250022,Опыт 3-6 лет,не указан,Нет,Не указано,data analyst,"kafka, jira, a/b",
Frontend-разработчик,АО Бюро кредитных историй Скоринг Бюро,Не указана,https://hh.ru/vacancy/133248346,Опыт 1-3 года,не указан,Нет,Комсомольская,data analyst,"git, jira, confluence",
Руководитель группы аккаунтинга B2B,Skyeng,Не указана,https://hh.ru/vacancy/133245358,Опыт 3-6 лет,не указан,Да,Не указано,data analyst,Не найдено,
Директор цифровой трансформации в производственную компанию,ООО ГЕТ ЭКСПЕРТС РЕКРУТМЕНТ,Не указана,https://hh.ru/vacancy/132752999,Опыт 3-6 лет,не указан,Нет,Москва Товарная,data analyst,машинное обучение,
PHP-разработчик,АО Бюро кредитных историй Скоринг Бюро,Не указана,https://hh.ru/vacancy/133248592,Опыт 3-6 лет,не указан,Да,Комсомольская,data analyst,"sql, postgresql, kafka",
Менеджер по развитию продуктов ИИ,ФГБУ Федеральный центр анализа и оценки техногенного воздействия,Не указана,https://hh.ru/vacancy/133238372,Опыт 3-6 лет,не указан,Нет,Нагатинская,data analyst,ml,
Руководитель центра корпоративной архитектуры,БКС IT & Digital,Не указана,https://hh.ru/vacancy/132305216,Опыт более 6 лет,не указан,Нет,Проспект Мира,data analyst,api,
Инженер-программист C++ \ QT,РОСКОСМОС,Не указана,https://hh.ru/vacancy/133212645,Опыт 1-3 года,не указан,Нет,Ботанический сад,data analyst,"postgresql, git",
Диджитал маркетолог,Kidzania,Не указана,https://hh.ru/vacancy/132750061,Опыт 3-6 лет,не указан,Нет,ЦСКА,data analyst,"excel, a/b",
Senior SMM-менеджер,Kalinka - Realty,Не указана,https://hh.ru/vacancy/132593270,Опыт 3-6 лет,senior,Нет,Добрынинская,data analyst,Не найдено,
Product Marketing Manager,Okko,Не указана,https://hh.ru/vacancy/133199016,Опыт 1-3 года,не указан,Нет,Баррикадная,data analyst,a/b,
ML Инженер,ООО ИКС-ПРО,Не указана,https://hh.ru/vacancy/133120888,Опыт 3-6 лет,не указан,Да,Красногорская,data analyst,"python, api, ml",
QA инженер,Сбер. IT,Не указана,https://hh.ru/vacancy/133136304,Опыт 3-6 лет,не указан,Нет,Не указано,data analyst,"python, sql, kafka, git, jira, confluence, api",
Product/UX-дизайнер в Учи.ру,"VK, Учи.ру",Не указана,https://hh.ru/vacancy/131477965,Опыт 3-6 лет,не указан,Да,Новокузнецкая,data analyst,Не найдено,
"Менеджер по продукту ""мобильное приложение селлера""",Ozon Офис и Коммерция,Не указана,https://hh.ru/vacancy/133141218,Опыт 3-6 лет,не указан,Нет,Деловой центр,data analyst,a/b,
Руководитель отдела маркетинга (международное продвижение бренда),ООО Софис,Не указана,https://hh.ru/vacancy/127879797,Опыт 3-6 лет,не указан,Нет,Дмитровская,data analyst,power bi,
Менеджер C&B (Премирование),ООО Сбер2B,Не указана,https://hh.ru/vacancy/133188299,Опыт 3-6 лет,не указан,Нет,Воронцовская,data analyst,excel,
Python/SQL разработчик аналитической инфраструктуры,Опт-Юнион,Не указана,https://hh.ru/vacancy/133186717,Опыт 3-6 лет,не указан,Нет,Планерная,data analyst,"python, sql, postgresql, power bi, excel, google sheets, power query, git, pandas, etl, api",
Продакт-менеджер AI-инструментов,Битрикс24,Не указана,https://hh.ru/vacancy/133222084,Опыт 1-3 года,не указан,Да,Площадь Ильича,data analyst,ml,
Директор по маркетингу (CMO) / Head of Marketing,ТВОЕ,Не указана,https://hh.ru/vacancy/133077045,Опыт более 6 лет,не указан,Нет,Сходненская,data analyst,Не найдено,
Директор по маркетингу / Менеджер по продуктовому маркетингу,Ubego,Не указана,https://hh.ru/vacancy/133272465,Опыт 3-6 лет,не указан,Да,Не указано,data analyst,"python, sql, power bi, tableau, a/b",
Специалист-стажер (C&B),"МАГНИТ, Розничная сеть. Офис",Не указана,https://hh.ru/vacancy/133121831,Без опыта,не указан,Нет,Водный стадион,data analyst,"qlik, excel, power query",
Руководитель направления по защите AI-инфраструктуры,Сбер. Кибербезопасность,Не указана,https://hh.ru/vacancy/133270599,Опыт более 6 лет,не указан,Нет,Не указано,data analyst,"api, ml",
Брокер по недвижимости в Москве,Neginski,Не указана,https://hh.ru/vacancy/133118101,Опыт 1-3 года,не указан,Нет,Марьина Роща,data analyst,Не найдено,
Senior Java - разработчик (АС СДР),СберЛизинг,Не указана,https://hh.ru/vacancy/133219399,Опыт более 6 лет,senior,Нет,Не указано,data analyst,"kafka, git, etl, api",
