title,company,salary,link,experience,grade,remote,metro,query,skills_found,published_date
Финансовый аналитик данных/Финансовый эксперт /Finance Business Partner (FBP),АО Виш Хоум Девелопмент,Не указана,https://adsrv.hh.ru/click,Опыт более 6 лет,не указан,Нет,Генерала Тюленева,аналитик данных,Не указаны,Не указана
Аналитик данных,ООО КАША.РУ,Не указана,https://hh.ru/vacancy/133222123,Опыт 1-3 года,не указан,Нет,Медведково,аналитик данных,"power bi, tableau, superset, metabase, datalens, excel, google sheets, power query, 1с, a/b, api",
Аналитик клиентских данных,Ингосстрах,Не указана,https://hh.ru/vacancy/133138425,Опыт 3-6 лет,не указан,Нет,Улица 1905 года,аналитик данных,"python, sql, oracle, power bi, tableau, qlik, datalens, a/b",
Аналитик данных маркетплейсов Wildberries OZON,Data-Power,Не указана,https://hh.ru/vacancy/132554083,Опыт 1-3 года,не указан,Да,Адмиралтейская,аналитик данных,"power bi, excel, power query, api",
Аналитик данных / Координатор задач,ООО Симпл Вэй Групп,Не указана,https://hh.ru/vacancy/133218848,Опыт 1-3 года,не указан,Нет,Воронцовская,аналитик данных,excel,
Аналитик платформы данных (Аналитик DWH),Цифровой аудит,Не указана,https://hh.ru/vacancy/133363769,Опыт 3-6 лет,не указан,Нет,Добрынинская,аналитик данных,sql,
Аналитик,Frank RG,Не указана,https://hh.ru/vacancy/132353585,Опыт 1-3 года,не указан,Нет,Не указано,аналитик данных,excel,
Аналитик,ООО ТЕНЕТ РУС,Не указана,https://hh.ru/vacancy/133367522,Опыт 3-6 лет,не указан,Нет,Балтийская,аналитик данных,"sql, excel",
Аналитик,ООО АвтоИнсДат,Не указана,https://hh.ru/vacancy/132545807,Опыт 1-3 года,не указан,Нет,Не указано,аналитик данных,"python, excel, pandas",
Аналитик данных/Data Quality,Datanomica,Не указана,https://hh.ru/vacancy/132210088,Опыт 1-3 года,не указан,Нет,ЗИЛ,аналитик данных,"python, sql, postgresql, redshift, hadoop, power bi, tableau, superset, excel, spark, pandas, numpy, a/b",
Аналитик,"ДЕТСКИЕ ДЕРЕВНИ-SOS, РОССИЙСКИЙ КОМИТЕТ",Не указана,https://hh.ru/vacancy/132999459,Опыт 1-3 года,не указан,Нет,Академическая,аналитик данных,"sql, oracle, excel",
Аналитик данных в направление развития корпоративной платформы данных,"АТОЛ, группа компаний",Не указана,https://hh.ru/vacancy/133298019,Опыт более 6 лет,не указан,Да,Алексеевская,аналитик данных,"sql, excel",
Аналитик данных,Элайд Ниппон,Не указана,https://hh.ru/vacancy/133106844,Опыт 1-3 года,не указан,Нет,Не указано,аналитик данных,"sql, excel",
GenAI LLM Аналитик данных middle / RAG + Python + SQL + BI-аналитик / Инженер данных,АО Мейджерпак Рус,Не указана,https://hh.ru/vacancy/131715420,Опыт 3-6 лет,middle,Нет,Авиамоторная,аналитик данных,"python, sql, postgresql, clickhouse, power bi, superset, excel, airflow, kafka, git, etl, api, ml",
Аналитик данных (направление Enterprise продаж),ООО HeadHunter::Коммерческий департамент,Не указана,https://hh.ru/vacancy/132591764,Опыт 1-3 года,не указан,Нет,Белорусская,аналитик данных,"python, sql, postgresql, trino, hadoop, tableau, pandas",
Финансовый аналитик,ИП Елисеев Максим Анатольевич,Не указана,https://hh.ru/vacancy/133222275,Опыт 3-6 лет,не указан,Да,Не указано,аналитик данных,"power bi, excel, google sheets",
Аналитик данных,АО МЕДИА ХИЛС,Не указана,https://hh.ru/vacancy/133089092,Опыт 1-3 года,не указан,Нет,Савёловская,аналитик данных,"python, sql, pandas, numpy",
Аналитик данных (В2В Sales),Aviasales.ru,Не указана,https://hh.ru/vacancy/131806244,Опыт 3-6 лет,не указан,Да,Не указано,аналитик данных,"sql, excel, api",
Системный аналитик (офис),ООО Лимон,Не указана,https://hh.ru/vacancy/133000573,Опыт 1-3 года,не указан,Нет,Савёловская,аналитик данных,sql,
Аналитик 1С,ООО БИОНОВА,Не указана,https://hh.ru/vacancy/132845018,Опыт 1-3 года,не указан,Нет,Бутырская,аналитик данных,1с,
Риск-аналитик (Prop Trading),ADF Capital,Не указана,https://hh.ru/vacancy/132856902,Опыт 3-6 лет,не указан,Да,Не указано,аналитик данных,"python, sql, excel, google sheets",
Специалист по базам данных,СТРОЙМАРКЕТ,Не указана,https://hh.ru/vacancy/133125083,Опыт 3-6 лет,не указан,Да,Добрынинская,аналитик данных,Не найдено,
Аналитик блокчейнов (цифровой комплаенс),АО Интелион Дата,Не указана,https://hh.ru/vacancy/133150300,Опыт 3-6 лет,не указан,Нет,Марксистская,аналитик данных,Не найдено,
Аналитик 1C,ООО Виктория - Софт,Не указана,https://hh.ru/vacancy/132994740,Опыт 3-6 лет,не указан,Да,Авиамоторная,аналитик данных,1с,
Системный аналитик (Web / Mobile),EKONIKA,Не указана,https://hh.ru/vacancy/132548483,Опыт 3-6 лет,не указан,Нет,Достоевская,аналитик данных,api,
Инвестиционный аналитик/Руководитель отдела поиска и аналитики (недвижимость),Global Invest Solutions,Не указана,https://hh.ru/vacancy/130219618,Опыт 3-6 лет,не указан,Нет,Не указано,аналитик данных,excel,
Инвестиционный аналитик (недвижимость),ООО Управляющая компания Помощь,Не указана,https://hh.ru/vacancy/133133543,Опыт 1-3 года,не указан,Нет,Арбатская,аналитик данных,excel,
Руководитель отдела коммерческой аналитики,Ozon fresh,Не указана,https://hh.ru/vacancy/132546932,Опыт 3-6 лет,не указан,Нет,Деловой центр,аналитик данных,"python, sql",
Аналитик данных (дата-сайентист),АО Московский ювелирный завод,Не указана,https://hh.ru/vacancy/129945390,Опыт 3-6 лет,не указан,Нет,Нагатинская,аналитик данных,Не найдено,
Старший бизнес-аналитик,Ассоциация ФинТех,Не указана,https://hh.ru/vacancy/132525299,Опыт 3-6 лет,senior,Нет,Александровский сад,аналитик данных,excel,
Старший аналитик (Клиентские исследования),Frank RG,Не указана,https://hh.ru/vacancy/129891526,Опыт 3-6 лет,senior,Нет,Не указано,аналитик данных,excel,
Аналитик данных (маркетплейсы),ООО Шварц,Не указана,https://hh.ru/vacancy/133412463,Опыт 1-3 года,не указан,Да,Беляево,аналитик данных,excel,
Старший / Химик-аналитик,ООО ОнкоТаргет,Не указана,https://hh.ru/vacancy/133195895,Опыт 3-6 лет,senior,Нет,Текстильщики,аналитик данных,Не найдено,
Старший менеджер по аналитике,"X5, Управляющая компания",Не указана,https://hh.ru/vacancy/132480947,Опыт 3-6 лет,senior,Нет,Добрынинская,аналитик данных,"python, sql, excel, google sheets, airflow, pandas, numpy, a/b",
Аналитик-разработчик BI,ООО Фитокосметик,Не указана,https://hh.ru/vacancy/133191804,Опыт 3-6 лет,не указан,Нет,Воронцовская,аналитик данных,"sql, power bi, excel, power query, 1с",
Бизнес‑аналитик (CRM/DMS),ООО ТЕНЕТ РУС,Не указана,https://hh.ru/vacancy/131922637,Опыт 3-6 лет,не указан,Нет,Балтийская,аналитик данных,"power bi, 1с",
BI-аналитик (в офисе),ООО Современные коммуникационные технологии,Не указана,https://hh.ru/vacancy/132518722,Опыт 3-6 лет,не указан,Нет,Говорово,аналитик данных,"sql, postgresql, power bi, datalens, excel, a/b",
Финансовый менеджер/Финансовый аналитик,ООО Литте,Не указана,https://hh.ru/vacancy/132981218,Опыт 1-3 года,не указан,Нет,Не указано,аналитик данных,"excel, google sheets",
Аналитик данных / Аккаунт менеджер,Медиагруппа Комсомольская правда,Не указана,https://hh.ru/vacancy/133401670,Опыт 1-3 года,не указан,Нет,Бутырская,аналитик данных,Не найдено,
"Аналитик данных (транспорт, предиктивная аналитика)",ИП Гринькова Светлана Борисовна,Не указана,https://hh.ru/vacancy/133383650,Опыт 1-3 года,не указан,Да,Не указано,аналитик данных,"python, sql, машинное обучение",
Системный аналитик (Senior) / Product Architect,ООО МАГ Девелопмент,Не указана,https://hh.ru/vacancy/132768463,Опыт более 6 лет,senior,Нет,Белорусская,аналитик данных,Не найдено,
Стажер-аналитик продаж / Intern sales,ООО Гарантис трейд,Не указана,https://hh.ru/vacancy/132993008,Без опыта,не указан,Нет,Бауманская,аналитик данных,excel,
"Стажер (продажи, аналитика, IT)",ООО Медико-фармацевтический дистрибьютор,Не указана,https://hh.ru/vacancy/132824802,Без опыта,не указан,Нет,Не указано,аналитик данных,"excel, 1с",
Аналитик-разработчик таблиц для работы с маркетплейсами (Wildberries),Бурлов Андрей,Не указана,https://hh.ru/vacancy/133372798,Опыт 1-3 года,не указан,Да,Деловой центр,аналитик данных,"google sheets, api",
Эксперт по товарной аналитике,OSTIN. Офис и мастерская,Не указана,https://hh.ru/vacancy/133046239,Опыт 3-6 лет,не указан,Нет,Аэропорт,аналитик данных,Не найдено,
Старший аналитик данных (ИИ-агенты) / Senior Business Data Analyst (Agentic Analytics),Gauss Money,Не указана,https://hh.ru/vacancy/132935051,Опыт 1-3 года,senior,Да,Не указано,аналитик данных,"python, sql, postgresql, pandas, api",
"Аналитик товаров / Категорийный менеджер / Продуктовый аналитик маркетплейсы (Одежда, Wildberries)",ООО Ройал Текс,Не указана,https://hh.ru/vacancy/133123653,Без опыта,не указан,Да,Не указано,аналитик данных,excel,
Бизнес-аналитик (разработка КБС/биометрия),Инфотекс Интернет Траст,Не указана,https://hh.ru/vacancy/132987456,Опыт 3-6 лет,не указан,Нет,Гражданская,аналитик данных,Не найдено,
Эксперт аналитик ЦФТ (PL+/ PLSQL),Газпромбанк. IT&Digital.Аналитика,Не указана,https://hh.ru/vacancy/132362500,Опыт 3-6 лет,не указан,Да,Добрынинская,аналитик данных,Не найдено,
Аналитик баз данных / Data Analyst,ООО Уффици Лимитед,Не указана,https://hh.ru/vacancy/132596458,Опыт 1-3 года,не указан,Нет,Киевская,аналитик данных,"python, sql, power bi, tableau, excel, google sheets, pandas, numpy",
Бизнес аналитик,VVP Group,Не указана,https://hh.ru/vacancy/130759087,Без опыта,не указан,Нет,Речной вокзал,аналитик данных,"sql, 1с",
Финансовый аналитик (в ИТ-компанию),Avanpost,Не указана,https://hh.ru/vacancy/133128662,Опыт 1-3 года,не указан,Нет,Не указано,аналитик данных,"excel, 1с",
Старший аналитик,"""МТС"", Аналитика",Не указана,https://hh.ru/vacancy/133266967,Опыт 1-3 года,senior,Нет,Киевская,аналитик данных,"python, sql, excel",
Младший аналитик / Аналитик в команду Клиентских иследований,Frank RG,Не указана,https://hh.ru/vacancy/133106430,Опыт 1-3 года,junior,Нет,Не указано,аналитик данных,excel,
Разработчик Power BI (BI-аналитик),"Красное & Белое, розничная сеть",Не указана,https://hh.ru/vacancy/131039485,Опыт 1-3 года,не указан,Нет,Деловой центр,аналитик данных,"power bi, power query",
Главный инспектор сводно-аналитической инспекции / Дата-аналитик,Счетная палата Российской Федерации,Не указана,https://hh.ru/vacancy/133220879,Опыт более 6 лет,не указан,Нет,Киевская,аналитик данных,"python, sql, postgresql, mysql, oracle, excel",
Стажер аналитик данных / Intern Data Analyst,Deft,Не указана,https://hh.ru/vacancy/133086985,Без опыта,не указан,Нет,Не указано,аналитик данных,"python, sql, excel",
Аналитик по товародвижению,АО Фруктовая лавка,Не указана,https://hh.ru/vacancy/132094249,Опыт 1-3 года,не указан,Нет,Рассказовка,аналитик данных,"power bi, excel, power query, 1с",
Бизнес-аналитик в отдел анализа эффективности стратегических инициатив,"ПАО ВТБ, Розничный бизнес",Не указана,https://hh.ru/vacancy/133199184,Опыт 1-3 года,не указан,Нет,Деловой центр,аналитик данных,"python, sql, postgresql, hadoop, excel, etl",
Ассортиментный аналитик,ООО Ошейд,Не указана,https://hh.ru/vacancy/133333705,Опыт 3-6 лет,не указан,Нет,Пионерская,аналитик данных,"excel, google sheets",
Дата-сайентист/Аналитик,Сбер. IT,Не указана,https://hh.ru/vacancy/133397504,Опыт 3-6 лет,не указан,Нет,Не указано,аналитик данных,"python, sql, excel, ml",
"Продуктовый аналитик, продукт ""кабинет продавца"", платные сервисы для продавца",Ozon Офис и Коммерция,Не указана,https://hh.ru/vacancy/133324884,Опыт 1-3 года,не указан,Нет,Деловой центр,аналитик данных,"python, sql, clickhouse, power bi, tableau, superset, airflow, git, a/b",
Руководитель отдела аналитики в сфере строительства,ООО Промышленное Строительство,Не указана,https://hh.ru/vacancy/133185518,Опыт 3-6 лет,не указан,Нет,Трубная,аналитик данных,Не найдено,
Аналитик (логистика),СДЭК,Не указана,https://hh.ru/vacancy/132742846,Опыт 3-6 лет,не указан,Да,Не указано,аналитик данных,"superset, excel, power query, 1с",
"Аналитик данных, финтех",SkillStaff,Не указана,https://hh.ru/vacancy/133220791,Опыт 3-6 лет,не указан,Да,Не указано,аналитик данных,Не найдено,
Аналитик по защите данных (Data protection),Бэнкс Софт Системс,Не указана,https://hh.ru/vacancy/133355447,Опыт 1-3 года,не указан,Нет,Автозаводская,аналитик данных,1с,
Стажер в направлении налоговой / экономической экспертизы и финансовых расследований,FI Group,Не указана,https://hh.ru/vacancy/133368989,Без опыта,не указан,Нет,Войковская,аналитик данных,excel,
BI аналитик/Аналитик отдела продаж,ООО Космопак Про Трейд,Не указана,https://hh.ru/vacancy/133404823,Опыт 1-3 года,не указан,Нет,Отрадное,аналитик данных,"python, sql, power bi, tableau, qlik, excel, google sheets, power query, etl",
Маркетолог-аналитик,Demis Group,Не указана,https://hh.ru/vacancy/133294941,Опыт 1-3 года,не указан,Да,Не указано,аналитик данных,"python, sql, power bi, superset, excel, pandas",
Аналитик данных,ПроКонтекст,Не указана,https://hh.ru/vacancy/132887378,Опыт 1-3 года,не указан,Нет,Бауманская,аналитик данных,"python, sql, postgresql, mysql, git, pandas, numpy, scikit, matplotlib, api",
Data analyst (GenAI),Сбер. IT,Не указана,https://hh.ru/vacancy/133348516,Опыт 3-6 лет,не указан,Нет,Не указано,аналитик данных,"python, sql, hadoop, spark, pandas, scikit, a/b",
Аналитик маркетплейсов ИП Овчинников Д,Оптович (ООО ОПТ 365),Не указана,https://hh.ru/vacancy/132954479,Опыт 1-3 года,не указан,Да,Не указано,аналитик данных,Не найдено,
Сuстемный аналитик,М.Видео-Эльдорадо. ИТ,Не указана,https://hh.ru/vacancy/133368656,Опыт 3-6 лет,не указан,Да,Не указано,аналитик данных,"sql, clickhouse, kafka",
Product Analyst (Авиасейлс OTA),Aviasales.ru,Не указана,https://hh.ru/vacancy/131333121,Опыт 3-6 лет,не указан,Да,Не указано,аналитик данных,"python, sql, tableau, a/b, ml",
Аналитик отдела маркетинга,АО Лемниската,Не указана,https://hh.ru/vacancy/133325277,Опыт 1-3 года,не указан,Нет,Белорусская,аналитик данных,excel,
Социолог-аналитик (прикладные социологические исследования),"ГРЧЦ, ФГУП",Не указана,https://hh.ru/vacancy/133352265,Опыт 1-3 года,не указан,Нет,Павелецкая,аналитик данных,excel,
Менеджер по управлению товарными запасами,Магазины Ароматный Мир формата food & wine,Не указана,https://hh.ru/vacancy/133395777,Опыт 1-3 года,не указан,Нет,Кунцевская,аналитик данных,"python, sql, excel, power query",
Старший специалист по клиентской аналитике,ANCOR,Не указана,https://hh.ru/vacancy/133369725,Опыт 1-3 года,senior,Нет,Беломорская,аналитик данных,"python, sql, power bi, tableau, looker, pandas, a/b, ml",
Продуктовый аналитик (TPP Supply),Островок.Ostrovok!Tech,Не указана,https://hh.ru/vacancy/133392806,Опыт 3-6 лет,не указан,Да,Достоевская,аналитик данных,"python, sql, tableau, metabase, a/b",
Ведущий аналитик данных,АО Национальная система платежных карт,Не указана,https://hh.ru/vacancy/132306887,Опыт 3-6 лет,не указан,Нет,Новокузнецкая,аналитик данных,"python, sql, hadoop, excel, spark",
Аналитик DWH в команду ЕХД 2.0,АО Банк ДОМ.РФ IT,Не указана,https://hh.ru/vacancy/133358758,Опыт 3-6 лет,не указан,Да,Гражданская,аналитик данных,"python, sql, clickhouse, oracle, greenplum, trino, airflow, dbt, etl",
Младший специалист-аналитик данных ВТБ РОСТ,Changellenge,Не указана,https://hh.ru/vacancy/133080486,Опыт 1-3 года,junior,Нет,Не указано,аналитик данных,"python, sql, power bi, tableau, qlik, excel",
Младший аналитик в инвестиционную компанию (коммерческая недвижимость),Global Invest Solutions,Не указана,https://hh.ru/vacancy/130970633,Опыт 1-3 года,junior,Нет,Не указано,аналитик данных,excel,
Старший аналитик отдела операционной поддержки планирования запасных частей,Avanta Россия,Не указана,https://hh.ru/vacancy/133257184,Опыт 3-6 лет,senior,Нет,Баррикадная,аналитик данных,"sql, power bi, excel",
Аналитик розничной сети (офис),ООО РАНТ трейд,Не указана,https://hh.ru/vacancy/133403980,Опыт 1-3 года,не указан,Нет,ВДНХ,аналитик данных,"sql, excel, power query, 1с",
Руководитель отдела аналитики,ООО ПРОМОМЕД,Не указана,https://hh.ru/vacancy/133324836,Опыт более 6 лет,не указан,Нет,Проспект Мира,аналитик данных,"sql, excel, power query",
Аналитик отдела аналитики и организационного проектирования,АО Авиакомпания Россия,Не указана,https://hh.ru/vacancy/133302270,Опыт 3-6 лет,не указан,Да,Не указано,аналитик данных,1с,
Старший специалист по планированию спроса,Bonduelle,Не указана,https://hh.ru/vacancy/133407742,Опыт 3-6 лет,senior,Нет,Красносельская,аналитик данных,"power bi, excel, power query",
"Стажер (аналитика,программирование)",ПАО Ростелеком,Не указана,https://hh.ru/vacancy/133213125,Без опыта,не указан,Нет,Курская,аналитик данных,"python, sql, excel, pandas, numpy, matplotlib",
Аналитик данных (DWH/BI),ООО Деко Системс,Не указана,https://hh.ru/vacancy/133307596,Опыт 3-6 лет,не указан,Да,Не указано,аналитик данных,"sql, oracle, greenplum, hadoop, tableau, superset",
Финансовый аналитик,MERLION: Бэк-офис,Не указана,https://hh.ru/vacancy/132744294,Опыт 3-6 лет,не указан,Нет,Мякинино,аналитик данных,"excel, 1с",
Аналитик данных,3Logic Group,Не указана,https://hh.ru/vacancy/131507328,Опыт 3-6 лет,не указан,Нет,Киевская,аналитик данных,"python, sql, excel, power query, pandas, numpy, etl, api, ml",
Финансовый аналитик,Фармфорвард,Не указана,https://hh.ru/vacancy/132882279,Опыт 3-6 лет,не указан,Нет,Багратионовская,аналитик данных,"excel, 1с",
Антифрод-аналитик,ООО Финтехробот,Не указана,https://hh.ru/vacancy/133044144,Опыт 1-3 года,не указан,Да,Не указано,аналитик данных,"python, sql, postgresql, mysql, pandas, ml",
